{
  "format": "soc-scene-ir",
  "version": 1,
  "target": {
    "id": "de2-115-fixed-v1",
    "runtime_abi": 1,
    "required_features": [
      "indexed-flat-rgb",
      "custom-rv32i-gameplay"
    ]
  },
  "coordinates": {
    "origin": [
      0,
      0,
      0
    ],
    "scale": 128,
    "axes": [
      1,
      2,
      3
    ]
  },
  "palette": [
    [
      45,
      45,
      60
    ],
    [
      80,
      140,
      60
    ],
    [
      110,
      105,
      100
    ],
    [
      170,
      130,
      50
    ],
    [
      210,
      65,
      55
    ]
  ],
  "meshes": [
    {
      "id": "floor",
      "role": "world",
      "vertices": [
        [
          -8,
          0,
          -8
        ],
        [
          8,
          0,
          -8
        ],
        [
          8,
          0,
          16
        ],
        [
          -8,
          0,
          16
        ]
      ],
      "triangles": [
        [
          0,
          3,
          2,
          1
        ],
        [
          0,
          2,
          1,
          1
        ]
      ]
    },
    {
      "id": "cube",
      "role": "actor",
      "vertices": [
        [
          -1,
          -1,
          -1
        ],
        [
          1,
          -1,
          -1
        ],
        [
          1,
          1,
          -1
        ],
        [
          -1,
          1,
          -1
        ],
        [
          -1,
          -1,
          1
        ],
        [
          1,
          -1,
          1
        ],
        [
          1,
          1,
          1
        ],
        [
          -1,
          1,
          1
        ]
      ],
      "triangles": [
        [
          0,
          3,
          2,
          2
        ],
        [
          0,
          2,
          1,
          2
        ],
        [
          4,
          5,
          6,
          3
        ],
        [
          4,
          6,
          7,
          3
        ],
        [
          0,
          4,
          7,
          4
        ],
        [
          0,
          7,
          3,
          4
        ],
        [
          1,
          2,
          6,
          2
        ],
        [
          1,
          6,
          5,
          2
        ],
        [
          3,
          7,
          6,
          3
        ],
        [
          3,
          6,
          2,
          3
        ],
        [
          0,
          1,
          5,
          4
        ],
        [
          0,
          5,
          4,
          4
        ]
      ]
    }
  ],
  "provenance": {
    "adapter": "authored-example",
    "description": "Original test geometry; no third-party game data"
  },
  "projection": {
    "focal": 160,
    "near_z": 257
  }
}
