{
  "format": "soc-scene-ir",
  "version": 1,
  "target": {
    "id": "de2-115-fixed-v1",
    "runtime_abi": 1,
    "required_features": [
      "indexed-flat-rgb",
      "triangle-collision",
      "first-person-controller"
    ]
  },
  "coordinates": {
    "origin": [
      0,
      0,
      0
    ],
    "scale": 128,
    "axes": [
      1,
      2,
      3
    ]
  },
  "palette": [
    [
      45,
      45,
      60
    ],
    [
      80,
      140,
      60
    ],
    [
      110,
      105,
      100
    ],
    [
      170,
      130,
      50
    ],
    [
      210,
      65,
      55
    ]
  ],
  "meshes": [
    {
      "id": "floor",
      "role": "world",
      "vertices": [
        [
          -8,
          0,
          -8
        ],
        [
          8,
          0,
          -8
        ],
        [
          8,
          0,
          16
        ],
        [
          -8,
          0,
          16
        ]
      ],
      "triangles": [
        [
          0,
          3,
          2,
          1
        ],
        [
          0,
          2,
          1,
          1
        ]
      ]
    },
    {
      "id": "platform",
      "role": "world",
      "vertices": [
        [
          -2,
          0,
          4
        ],
        [
          2,
          0,
          4
        ],
        [
          2,
          1,
          4
        ],
        [
          -2,
          1,
          4
        ],
        [
          -2,
          0,
          8
        ],
        [
          2,
          0,
          8
        ],
        [
          2,
          1,
          8
        ],
        [
          -2,
          1,
          8
        ]
      ],
      "triangles": [
        [
          0,
          3,
          2,
          3
        ],
        [
          0,
          2,
          1,
          3
        ],
        [
          4,
          5,
          6,
          3
        ],
        [
          4,
          6,
          7,
          3
        ],
        [
          0,
          4,
          7,
          3
        ],
        [
          0,
          7,
          3,
          3
        ],
        [
          1,
          2,
          6,
          3
        ],
        [
          1,
          6,
          5,
          3
        ],
        [
          3,
          7,
          6,
          4
        ],
        [
          3,
          6,
          2,
          4
        ],
        [
          0,
          1,
          5,
          3
        ],
        [
          0,
          5,
          4,
          3
        ]
      ]
    },
    {
      "id": "back-wall",
      "role": "world",
      "vertices": [
        [
          -8,
          0,
          15
        ],
        [
          8,
          0,
          15
        ],
        [
          8,
          4,
          15
        ],
        [
          -8,
          4,
          15
        ],
        [
          -8,
          0,
          16
        ],
        [
          8,
          0,
          16
        ],
        [
          8,
          4,
          16
        ],
        [
          -8,
          4,
          16
        ]
      ],
      "triangles": [
        [
          0,
          3,
          2,
          2
        ],
        [
          0,
          2,
          1,
          2
        ],
        [
          4,
          5,
          6,
          2
        ],
        [
          4,
          6,
          7,
          2
        ],
        [
          0,
          4,
          7,
          2
        ],
        [
          0,
          7,
          3,
          2
        ],
        [
          1,
          2,
          6,
          2
        ],
        [
          1,
          6,
          5,
          2
        ],
        [
          3,
          7,
          6,
          2
        ],
        [
          3,
          6,
          2,
          2
        ],
        [
          0,
          1,
          5,
          2
        ],
        [
          0,
          5,
          4,
          2
        ]
      ]
    }
  ],
  "controller": {
    "spawn": [
      0,
      0,
      0
    ],
    "physics": {
      "speed": 12,
      "radius": 32,
      "height": 112,
      "step_height": 36,
      "gravity": 2,
      "jump_speed": 18,
      "kill_y": -2048
    },
    "camera": {
      "eye_height": 92,
      "focal": 160,
      "near_z": 257,
      "initial_yaw": 0,
      "region_radius": 2048
    }
  },
  "provenance": {
    "adapter": "authored-example",
    "description": "Original test geometry; no third-party game data"
  }
}
